комплект постельного белья василиса чайный сервиз,100% хлопок, сатин: 1,5- спальный – 1999 руб. 2- спальный – 2499 руб. евро – 2999 руб. дуэт – 3499 руб.
полотенце махровое облака: - 30х 50 см – 69,99 руб. - 50х 80 см – 149,99 руб. - 70х 120 см – 299,99 руб.
полотенце, 1 уп., дизайны в ассортименте
текстиль: - скатерть: винил: 110х 140 см – 199,90 руб.; 150х 225 см – 399,90 руб.; полулен, 178х 140 см – 1299 руб. - салфетки, полулен, 45х 45 см, 2 шт. в уп. – 249,99 руб.
набор посуды taller, нержавеющая сталь, с силиконовыми ручками, с крышками - кастрюля, 2,7 л - ковш, 1,3 л
набор столовых приборов taller, нержавеющая сталь, 24 предмета, в ассортименте
посуда rondell: - френч- пресс, 600 мл – 499,99 руб. - кофеварка, гейзерная, 300 мл – 999,99 руб. - чайник, 3 л – 1799 руб.
посуда rondell turquoise, с крышкой: - ковш, 1,5 л – 1599 руб. - кастрюля, 2,8 л – 1899 руб.; 3,8 л – 1999 руб. - чайник, 2 л – 1899 руб.
аксессуары, стекло: - подставка для украшений, 8х 8 см – 149,99 руб. - шкатулка: сердечко, 9,7х 7,8 см – 199,99 руб.; бабочка, 7,5х 7,5 см – 229,99 руб. - ваза – от 399,99 руб.
посуда atmosphere триумф: - салатник: 13 см – 199,99 руб.; 24 см – 499,99 руб.; 20 см – 599,99 руб. - блюдо, 25 см – 449,99 руб. - ваза, 24 см – 699,99 руб.
посуда atmosphere сamelia, стекло: - салатник, 13 см – 169,99 руб.; 21,5 см – 499,99 руб. - сахарница, с крышкой, 12 см – 249,99 руб. - блюдо сервировочное, 21 см – 299,99 руб. - ваза, 23 см – 699,99 руб.
посуда, стекло: - подставка для ложки – 69,99 руб. - тарелка: 15х 15 см – 69,99 руб.; 20х 20 см – 99,99 руб.
посуда, стекло: - тарелка для торта, с лопаткой: 23 см – 199,99 руб.; 30х 30 см – 299,99 руб. - подставка для закусок и фруктов, 2- ярусная – 399,99 руб.
кружка, стекло/ фарфор, 300–480 мл, в ассортименте
зонт: - автомат: ds- 331 – 359 руб. - суперавтомат: – 549 руб.
зеркало homeclub bcm- 1136, с подсветкой - 16 светодиодов - вращение на 180° - место для хранения украшений
открытка арт и дизайн, двойная: - код а – 15,99 руб. - код ф – 44,99 руб.
упаковка подарочная: - пакет декоративный – от 15,99 руб. - бумага, 70х 100 см – 29,99 руб.
полотенце махровое эдельвейс, с бордюром, 100% хлопок, в подарочной упаковке, 50х 80 см в ассортименте представлен размер: - 70х 120 см – 299,99 руб.
полотенце вафельное сувенирное, 100% хлопок, 50х 60 см
набор мисок архимед дорос: 1,3 л; 2,2 л; 5 л; дуршлаг, 26 см
посуда pasabahce borcam, жаропрочное стекло: - форма для выпечки: 22х 22 см – 199,99 руб.; 32х 28 см, 40х 25 см – 299,99 руб. - кастрюля с крышкой, 1,5 л – 299,99 руб.
сковорода atmosphere marble, с антипригарным покрытием, в ассортименте
товары для приготовления и упаковки пищи primapack, в ассортименте
посуда atmosphere alfa: - ковш, 1,6 л – 589,99 руб. - кастрюля: 2,3 л – 589,99 руб.; 3,1 л – 659,99 руб.; 5,8 л – 919,99 руб.
набор посуды crystalex ангела, чехия, отводка золото, панто, хрустальное стекло, 1 уп.: - бокалы, 2 шт.: для вина, 250 мл; для шампанского, 190 мл – 499,99 руб. - рюмки, 60 мл, 6 шт. – 999,99 руб.
губка для посуды лента, 1 уп.: - профильная, 90х 70х 44 мм, 3 шт. - макси, 100х 70х 30 мм, 8 шт.
мешки для мусора swirl, с завязками, 1 уп., в ассортименте
салфетки универсальные лента для уборки, 1 уп.: - из микрофибры, 30х 30 см – 27,99 руб. - вискозные, перфорированные, 34х 38 см, 5 шт. – 28,89 руб. - целлюлозная, 15х 15 см, 3 шт. – 39,99 руб.
товары для уборки hausmann: - насадка для швабры, микрофибра: с механизмом отжима; со слайд- механизмом – 199,90 руб. - швабра: с механизмом отжима; со слайд- механизмом – 1199 руб.
доска гладильная eurogold europa, 120x38 см: - розетка с удлинителем 1,4 м - держатель для шнура - полка для белья
принадлежности постельные, шерсть: - подушка win collection every day - одеяло бельвита
принадлежности постельные даргез эквадор, волокно на основе эвкалипта, чехол микрофибра: - подушка - одеяло
полотенце махровое ardenza, 100% хлопок, жаккард: - 50х 80 см – 139,99 руб. - 70х 120 см – 249,99 руб.
комплект постельного белья mona liza premium, сатин, 100% хлопок: - 1,5- спальный – 1699 руб. - 2- спальный – 2299 руб. - евро – 2699 руб. - семейный – 3199 руб.
комплект постельного белья mona liza classik textile, бязь, 100% хлопок: - 1,5- спальный – 899,99 руб. - 2- спальный – 1149 руб. - евро – 1299 руб. - семейный – 1499 руб.
чемодан fm, pc7235, пластиковый, поликарбонат: - 51 см – 3299 руб. - 61 см – 3599 руб. - 71 см – 4299 руб.
чемодан fm, dyt- 530, текстиль: - 51 см – 2699 руб. - 61 см – 2999 руб. - 71 см – 3499 руб.
набор столовый luminarc poeme, стекло, 18 предметов, цвета в ассортименте
средство для стирки ласка, 1 л, в ассортименте
средства для стирки losk, автомат: - капсулы duo- caps, 21 шт. в уп. - порошок, 4,5 кг - гель, 2,19 л
гель для стирки typhoon, концентрированный, 980 мл, в ассортименте
средства для стирки persil, автомат: - гель, 2,19 л х 2 шт. - порошок, 9 кг
средства для стирки миф, автомат: - порошок, 4 кг - гель, 1,56 л
кондиционер для белья lenor, концентрированный, 930–1000 мл, в ассортименте
средство жидкое для стирки wellery delicate, 1 л, в ассортименте
средства для стирки tide, автомат: - капсулы, 15 шт. в уп. - порошок, 3 кг - гель, 1,235 л
средство для мытья посуды лента, 1000 мл, в ассортименте
средство для мытья полов лента, универсальное, 1 л, в ассортименте
пятновыводитель vanish oxi action, универсальный/ с отбеливателем: - 500 г - 1 л
таблетки для посудомоечных машин лента, 7 in 1, 60 шт. в уп.
средство для мытья посуды fairy, 650–900 мл, в ассортименте
средства чистящие для туалета bref, 150 г, в ассортименте
освежитель воздуха air wick freshmatic complete, автоматический, со сменным баллоном, 250 мл, в ассортименте
набор подарочный taft объем/ ultimate - лак, 225 мл - пена, 150 мл - косметичка
набор подарочный gliss kur: - анти- кризис – 179,09 руб. - реновация – 298,59 руб.
набор подарочный syoss salon plex - шампунь, 500 мл - бальзам, 500 мл - косметичка
косметика для ухода за волосами vilenta, 280 мл: - шампунь - бальзам
косметика для ухода за волосами l’oreal: - краска excellence, 176 мл - спрей magic retouch, 75 мл
косметика gliss kur, 150–300 мл: - шампунь, бальзам – 119,99 руб. - экспресс- кондиционер, масло- спрей, маска – 189,99 руб.
краска- мусс для волос perfect mousse, 92,5 мл, в ассортименте
косметика для волос natura siberica, 400 мл: - шампунь - бальзам
крем nivea: - универсальный, 150 мл – 119,99 руб. - для лица, 50–126 мл – 149,99 руб. - для тела, 200 мл – 179,99 руб.
косметика для лица green mama: - лосьон для снятия макияжа с глаз, 100 мл - скраб, 170 мл - гель- крем, 300 мл - маска, 170 мл
гель для душа fa, 250 мл, в ассортименте
дезодорант fa: - ролик, 50 мл – 59,99 руб. - спрей, 150 мл – 84,99 руб.
дезодорант nivea, 50 мл, в ассортименте
дезодорант garnier, спрей, 150 мл: mineral активный контроль, невидимый, невидимый против влажности, невидимый ледяная свежесть, термозащита, эффект чистоты
косметика для губ nivea: - бальзам, 4,8 г – 89,99 руб. - масло, 17 г – 149,99 руб.
гель для душа palmolive, 250 мл, в ассортименте
косметика barnangen, 400 мл: - гель для душа – 229,99 руб. - лосьон для тела – 289,99 руб.
вода парфюмированная ascania, 50 мл, в ассортименте
ополаскиватель для ухода за полостью рта listerine expert, 250 мл, в ассортименте
средства для ухода за полостью рта colgate: - щетка зубная: средняя, мягкая - паста зубная, 75 мл
средства для ухода за полостью рта r.o.c.s.: - паста зубная, 74–94 г - щетка зубная
шампунь/ гель le petit marseillais, 250 мл, в ассортименте
косметика для ухода за волосами shamtu: - бальзам- ополаскиватель, 200 мл - шампунь, 360 мл
шампунь для волос clear vita abe, женский/ мужской, 400 мл, в ассортименте
средства для укладки волос taft: - пена, 150 мл - лак, 225 мл
крем- краска для волос syoss, 115 мл, в ассортименте
крем для рук белоручка, смягчающий, 75 мл
вода туалетная/ парфюмированная apple parfums, женская, 50- 100 мл: - роза: красная, нежная, золотая - couture: organza, chantilly
